{"attachment":{"local_transform":["1","0","0","1","0","0"],"visual_root_path":"VisualRoot"},"collision":{"collision_layer":2,"collision_mask":0,"footprint_size":["28","26"],"global_transform":["1","0","0","1","-320","1252"],"navigation_outline":[["-334","1239"],["-306","1239"],["-306","1265"],["-334","1265"]],"node_path":"TrunkFootprint"},"depth_chain":[{"path":".","y_sort_enabled":false,"z_as_relative":true,"z_index":0},{"path":"DepthSortedLayer","y_sort_enabled":true,"z_as_relative":true,"z_index":0},{"path":"DepthSortedLayer/WorldObjects","y_sort_enabled":true,"z_as_relative":true,"z_index":0},{"path":"DepthSortedLayer/WorldObjects/RiversideProps","y_sort_enabled":true,"z_as_relative":true,"z_index":0},{"path":"DepthSortedLayer/WorldObjects/RiversideProps/RiverDepthTree","y_sort_enabled":false,"z_as_relative":true,"z_index":0}],"global_transform":["1","0","0","1","-320","1270"],"navigation":{"agent_clearance":"11","navigation_layers":1,"obstruction_ref":"DepthSortedLayer/WorldObjects/RiversideProps/RiverDepthTree/TrunkFootprint","region_path":"Navigation"},"node_path":"DepthSortedLayer/WorldObjects/RiversideProps/RiverDepthTree","projection_schema_version":"tree-authority-1","semantic_event_ids":[],"shadow":{"local_transform":["0.3199999928474426","0","0","0.3199999928474426","0","-5"],"node_path":"ShadowVisual","z_as_relative":true,"z_index":-1},"stable_id":"river_depth_tree","world_id":"willicat_home_continuous_v1"}